[
  {
    "schema_version": "1.0",
    "verification_id": "ver_installed_total_group_1543b65f_text",
    "input_name": "group_installed_capacity",
    "claim_id": "cl1_5b1e9c502b174acc1543b65f",
    "assertion": {
      "value": 79930,
      "unit": "MW",
      "period_type": "as_of",
      "as_of_date": "2025-03-31",
      "period_text": "As on 31 March 2025",
      "basis": "consolidated",
      "statement_status": "commissioned",
      "label_terms": [
        "commercial capacity"
      ],
      "entity": "NTPC Limited"
    },
    "outcome": "confirmed",
    "verification_level": "extracted_text_review",
    "source": {
      "source_chunk_id": "ev_252ddc5ca75aa6a8bc871cb1",
      "source_path": "CSV/annual reports/Annual Report 2024-25_1.csv",
      "page": 90,
      "url": null,
      "publisher": null,
      "publication_date": null,
      "retrieved_at": null,
      "document_family": "Annual Report 2024-25_1.csv",
      "passage": "\"DIRECTORS’ REPORT Dear Members, Financial Year ended 31 March 2025, the Auditors’ report, and comments of the Comptroller and Auditor General On behalf of the Board of Directors, it is our privilege to (CAG) of India on the financial statements thereon. present the 49th Annual Report and 6th Integrated Annual Report of NTPC Limited (‘NTPC” or Your Company) for the NTPC’s unwavering commitment to drive Nation’s energy Financial Year ended 31 March 2025 along with Audited transition remained at the core of its operations and Standalone and Consolidated Financial Statements for the strategic initiatives during the FY 2024-25. Major Highlights of your Company for the financial year 2024-25 are outlined below, providing a brief overview of accomplishments across all operational and strategic fronts: • At the group level, your Company added 3,972 MW of commercial capacity during the year. As on 31 March 2025, the total commercial capacity stood at 79,930 MW on a consolidated basis and 59,413 MW on a standalone basis. • Power generation recorded a growth of 3.08% on a standalone basis and 3.90% at the group level. • Your Company achieved a remarkable average Plant Load Factor (PLF) of 77.44% in FY25, significantly higher than the national average of 69.96% for coal-based plants. This marked the highest PLF recorded by the Company in the past seven years. • Notably, seven of your Company’s stations ranked among the top 15 performers in the All-India PLF rankings. • The captive coal production witnessed a steep year-on-year growth of 29%, increasing from 35.64 MMT in FY24 to 45.82 MMT in FY25. This significant rise has strengthened long-term fuel security for the Company’s operations. • Your Company at group level has made significant progress in strengthening fuel security. In FY25, a total of 282.80 MMT of coal was received, reflecting a 5.2% increase over the 268.70 MMT received in the previous year. Notably, only 2.53 MMT of this was imported coal, resulting a substantial reduction compared to 10.50 MMT imported in the previous year, underscoring the Company’s continued focus on enhancing domestic coal sourcing and reducing dependence on imports. • The successful listing of NTPC Green Energy Limited (NGEL) on 27th November 2024 through its initial public offer (IPO) of ` 10,000 crore marked a significant milestone, positioning NGEL as a prominent player in India’s renewable energy sector. • In line with NTPC’s broader vision to accelerate its renewable energy expansion and strengthen its sustainability commitment, ONGC NTPC Green Private Limited (ONGPL) - a 50:50 joint venture of NTPC Green Energy Limited and ONGC Green Limited has acquired 100% equity stake in Ayana Renewable Power (P) Limited, having an enterpise value of ` 19,500 crore. It has 2,123 MW operational and 1,989.7 MW under construction capacity. • Govt. of India has approved transfer of Mahi Banswara Rajasthan Atomic Power Project (MBRAPP) 4x700 MWe based on indigenous PHWR technology, from Nuclear Power Corporation of India Limited (NPCIL) to the JV Company i.e. Anushakti Vidhyut Nigam Ltd (ASHVINI). • Your Company’s group Level total income for FY25 increased by 5%, amounting to ` 190,862 crore compared to ` 1,81,166 crore in FY24. • The Group CAPEX for FY25 rose to ` 48,594.59 crore, making a notable increase from ` 35,385 crore in FY24. On a standalone basis, CAPEX recorded strong growth reaching ` 23,664.59 crore from ` 19,444 crore in the previous year. • The Dividend income of ` 2,101.48 crore recognized from its subsidiaries, joint venture companies, and others in FY25, as compared to ` 1,639.08 crore recognized in FY24, reflecting a healthy growth in returns from strategic investments. • Your Company triumphed again at the ‘ATD BEST Awards 2025’, marking its eighth win in talent development excellence. Your Company is also certified as a “Top Employer 2025” in India by Brandon Hall Group. 176 | INTEGRATED ANNUAL REPORT - 2024-25\",\"The following is a summary",
      "passage_sha256": "7074c05795cbfe5267ad2709fbdb42d791c01c383945f5d33bd81f3be9246015"
    },
    "checks": {
      "entity": {
        "result": "match",
        "detail": "target/self-reference near the figure"
      },
      "value": {
        "result": "match",
        "detail": "79930 found in the passage"
      },
      "unit_scale": {
        "result": "match",
        "detail": "unit 'MW' next to the number supports MW"
      },
      "metric_definition": {
        "result": "match",
        "detail": "label terms ['commercial capacity'] appear near the figure"
      },
      "period": {
        "result": "match",
        "detail": "period 2025-03-31 appears with the figure"
      },
      "basis": {
        "result": "match",
        "detail": "'consolidated' is the nearest basis word"
      },
      "statement_status": {
        "result": "match",
        "detail": "commissioned/commercial wording present"
      }
    },
    "cross_checks": [],
    "discrepancies": [],
    "rationale": "Value, unit/scale, label terms, period, basis, status and entity are each supported by the cited passage.",
    "reviewer": {
      "kind": "ai_assisted_analyst",
      "id": "claude-sonnet-5-5",
      "note": "Variant of ntpc_renewable_pipeline_reviewed_inputs.json (left unchanged) that takes the page-91 table values from PDF-native table claims (pdf_table_extraction, original PDF sha256 28f32ae3...) instead of the interleaved-text narrative claims, and adds the parent's directly reported figures (Total (I) 15,376 MW; renewable 725 MW) so the parent shares use direct values, not the 709 MW residual. Ownership scope is the table's own section heading; basis/status fields below are analyst assertions that the verifier re-checks mechanically against the cited chunk."
    },
    "limitations": [
      "The passage is the project's own text extraction of the filing; the original PDF/official URL was not checked. This is not primary-source verification."
    ]
  },
  {
    "schema_version": "1.0",
    "verification_id": "ver_installed_total_group_ntpc_ar_fy2024_25",
    "input_name": "group_installed_capacity",
    "claim_id": "cl1_5b1e9c502b174acc1543b65f",
    "assertion": {
      "value": 79930,
      "unit": "MW",
      "period_type": "as_of",
      "as_of_date": "2025-03-31",
      "period_text": "As on 31 March 2025",
      "basis": "consolidated",
      "statement_status": "commissioned",
      "label_terms": [
        "commercial capacity"
      ],
      "entity": "NTPC Limited"
    },
    "outcome": "partially_supported",
    "verification_level": "primary_source",
    "source": {
      "source_chunk_id": null,
      "source_path": "https://ntpc.co.in/sites/default/files/annual-report/complete-reports/Annual%20Report%202024-25_1.pdf",
      "page": 91,
      "url": "https://ntpc.co.in/sites/default/files/annual-report/complete-reports/Annual%20Report%202024-25_1.pdf",
      "publisher": "NTPC Limited",
      "publication_date": "2025-08-07",
      "retrieved_at": null,
      "document_family": "ntpc_ar_fy2024_25",
      "passage": "Additionally, when considering the collective efforts of your Company and its joint ventures & subsidiaries, the aggregate group level commercial capacity was further augmented by 3,972 MW resulting in an overall group level commercial capacity of 79,930 MW as per detail given below: - Description Capacity (MW) Owned by your Company Coal based projects 53,850 Gas based projects 4,017 Hydro Projects 800 Renewable Energy Projects (Including Singrauli small hydro) 746 Sub-total 59,413 Joint Ventures & Subsidiaries Coal based projects 9,004 Gas based projects (Including NEEPCO-527 MW) 2,494 Hydro Projects of THDCL (1,424 MW) & NEEPCO (1525 MW) 2,925 Renewable Energy Projects including THDCL (163 MW) & NEEPCO (5 MW) & Ayana Power -ONGPL (2123 MW) 6,094 Sub-total 20,517 Total 79,930 9.",
      "passage_sha256": "8b8e11ae334e29fd3b4d4f81345ae071491587f245745ed678a2d4487bbb462e"
    },
    "checks": {
      "entity": {
        "result": "unresolved",
        "detail": "both the target and other organization(s) ['NEEPCO', 'ONGPL', 'THDCL'] are named near the figure; whose figure it is is not settled"
      },
      "value": {
        "result": "match",
        "detail": "79930 found in the passage"
      },
      "unit_scale": {
        "result": "match",
        "detail": "unit 'MW' next to the number supports MW"
      },
      "metric_definition": {
        "result": "match",
        "detail": "label terms ['commercial capacity'] appear near the figure"
      },
      "period": {
        "result": "unresolved",
        "detail": "no period phrase near the figure"
      },
      "basis": {
        "result": "match",
        "detail": "'group level' is the nearest basis word"
      },
      "statement_status": {
        "result": "match",
        "detail": "commissioned/commercial wording present"
      }
    },
    "cross_checks": [],
    "discrepancies": [],